{"type":"config","name":"Optimize Tartalo codegen performance and generated code quality","metricName":"codegen_ns","metricUnit":"ns","bestDirection":"lower"}
{"run":1,"commit":"a814708","metric":5324,"metrics":{"compile_ns":21727,"run_med_ms":134,"fizzbuzz_bytes":571,"perf_bytes":1723,"perf_lines":107,"compile_allocs":588,"codegen_allocs":168},"status":"keep","description":"Baseline measurement of current codegen performance","timestamp":1778009862597,"segment":0,"confidence":null,"asi":{"hypothesis":"Establish baseline metrics before any optimizations","benchmark_version":"1"}}
{"run":2,"commit":"e5821d6","metric":5122,"metrics":{"codegen_allocs":167,"compile_allocs":587,"compile_ns":21697,"fizzbuzz_bytes":571,"perf_bytes":1723,"perf_lines":107,"run_med_ms":132},"status":"keep","description":"Optimize codegen: fast itoa, concatPrologues, writeLine byte writes, escapeForDoubleQuoted prealloc","timestamp":1778009967195,"segment":0,"confidence":null,"asi":{"hypothesis":"Reduce allocations in hot paths: replace fmt.Sprintf in tmp() with string concat+fast itoa, use WriteByte instead of WriteString for indentation, preallocate escapeForDoubleQuoted builder, and add concatPrologues to avoid double-slice allocation"}}
{"run":3,"commit":"e5821d6","metric":5004,"metrics":{"codegen_allocs":167,"compile_allocs":587,"compile_ns":21749,"fizzbuzz_bytes":571,"perf_bytes":1723,"perf_lines":107,"run_med_ms":130},"status":"discard","description":"Re-baseline after reverting needsArgv (no code change)","timestamp":1778010152275,"segment":0,"confidence":1.7118644067796611,"asi":{"hypothesis":"Re-baseline to confirm metrics after revert","rollback_reason":"No code change - just confirming baseline variance is ~100-200ns","next_action_hint":"Proceed with next optimization"}}
{"run":4,"commit":"df7fbfe","metric":4959,"metrics":{"codegen_allocs":167,"compile_allocs":587,"compile_ns":21278,"fizzbuzz_bytes":571,"perf_bytes":1723,"perf_lines":107,"run_med_ms":130},"status":"keep","description":"Remove discard comments and no-op expr stmts to shrink output and reduce codegen work","timestamp":1778010311614,"segment":0,"confidence":4.478527607361963,"asi":{"hypothesis":"Eliminating unnecessary comment lines for discarded values reduces strings.Builder work and output size"}}
{"run":5,"commit":"747861f","metric":4925,"metrics":{"codegen_allocs":167,"compile_allocs":587,"compile_ns":21397,"fizzbuzz_bytes":571,"perf_bytes":1700,"perf_lines":106,"run_med_ms":127},"status":"keep","description":"Optimize len() for simple string vars: skip temp, use ${#name} directly","timestamp":1778010629621,"segment":0,"confidence":5.050632911392405,"asi":{"hypothesis":"For len(stringVar) we can emit ${#name} directly instead of copying to a temp first, reducing generated code size and runtime overhead"}}
{"run":6,"commit":"fa9f45e","metric":4961,"metrics":{"codegen_allocs":167,"compile_allocs":587,"compile_ns":21542,"fizzbuzz_bytes":565,"perf_bytes":1656,"perf_lines":106,"run_med_ms":124},"status":"keep","description":"Simplify numeric test operands: use $var instead of $((var)) for simple identifiers","timestamp":1778010765696,"segment":0,"confidence":9.851851851851851,"asi":{"hypothesis":"In [test -eq] contexts, simple identifiers can use '$name' instead of '$((name))', reducing output size and shell parsing overhead"}}
{"run":7,"commit":"c430967","metric":4879,"metrics":{"codegen_allocs":162,"compile_allocs":582,"compile_ns":21231,"fizzbuzz_bytes":565,"perf_bytes":1656,"perf_lines":106,"run_med_ms":127},"status":"keep","description":"Inline constant range end bounds: skip temp variable for integer literal ranges","timestamp":1778010840476,"segment":0,"confidence":10.348837209302326,"asi":{"hypothesis":"Constant integer range ends don't need a temp variable; inlining saves an assignment and a variable declaration"}}
{"run":8,"commit":"72597e6","metric":4857,"metrics":{"codegen_allocs":162,"compile_allocs":582,"compile_ns":21200,"fizzbuzz_bytes":546,"perf_bytes":1635,"perf_lines":105,"run_med_ms":124},"status":"keep","description":"Skip cond temp for simple bool/number identifiers in compileCond fallback","timestamp":1778010940796,"segment":0,"confidence":7.472,"asi":{"hypothesis":"Simple boolean/number identifiers in condition fallback don't need a temp; test $var directly"}}
{"run":9,"commit":"a77fa70","metric":4897,"metrics":{"codegen_allocs":162,"compile_allocs":582,"compile_ns":21308,"fizzbuzz_bytes":546,"perf_bytes":1610,"perf_lines":104,"run_med_ms":126},"status":"keep","description":"Inline bare identifier range ends: skip temp for simple param/variable bounds","timestamp":1778011128904,"segment":0,"confidence":7.532258064516129,"asi":{"hypothesis":"For range loops with identifier end bounds like 0..n, skip the __end temp and compare against $n directly"}}
{"run":10,"commit":"1d459bc","metric":4793,"metrics":{"codegen_allocs":158,"compile_allocs":578,"compile_ns":21135,"fizzbuzz_bytes":546,"perf_bytes":1589,"perf_lines":103,"run_med_ms":125},"status":"keep","description":"Replace fmt.Sprintf with string concat in emitFunc param bindings","timestamp":1778011252666,"segment":0,"confidence":8.496,"asi":{"hypothesis":"fmt.Sprintf has noticeable overhead for simple string assembly; using concat+itoa in hot emitFunc path reduces allocations and CPU time"}}
{"run":11,"commit":"3892d5c","metric":4619,"metrics":{"codegen_allocs":148,"compile_allocs":568,"compile_ns":21010,"fizzbuzz_bytes":546,"perf_bytes":1589,"perf_lines":103,"run_med_ms":125},"status":"keep","description":"Skip __ret temp for direct function-call assignments and returns","timestamp":1778011442543,"segment":0,"confidence":10.367647058823529,"asi":{"hypothesis":"When a function call is the entire RHS of an assignment/return, __ret already holds the value; skip the __retN temp and assign directly from __ret"}}
{"run":12,"commit":"3a56e52","metric":4503,"metrics":{"codegen_allocs":143,"compile_allocs":563,"compile_ns":20842,"fizzbuzz_bytes":546,"perf_bytes":1526,"perf_lines":100,"run_med_ms":129},"status":"keep","description":"Skip temp for simple variable iteration in for-in loops","timestamp":1778011553425,"segment":0,"confidence":11.170068027210885,"asi":{"hypothesis":"When iterating over a simple string variable, use it directly in the heredoc instead of copying to __linesN temp"}}
{"run":13,"commit":"ad701a7","metric":4455,"metrics":{"codegen_allocs":137,"compile_allocs":557,"compile_ns":21031,"fizzbuzz_bytes":546,"perf_bytes":1495,"perf_lines":99,"run_med_ms":127},"status":"keep","description":"Use bare $var in emitReturn for simple identifiers instead of $((var))","timestamp":1778011827031,"segment":0,"confidence":8.35576923076923,"asi":{"hypothesis":"For simple identifier returns, __ret=$name is shorter and faster than __ret=$((name))"}}
{"run":14,"commit":"ad701a7","metric":4512,"metrics":{"codegen_allocs":137,"compile_allocs":557,"compile_ns":20974,"fizzbuzz_bytes":546,"perf_bytes":1487,"perf_lines":99,"run_med_ms":124},"status":"discard","description":"Cache indentation strings (hurt performance slightly)","timestamp":1778011900668,"segment":0,"confidence":8.236966824644549,"asi":{"hypothesis":"Pre-cached indent strings reduce writeLine overhead","next_action_hint":"The slice lookup was not faster than raw byte writes for shallow indent","rollback_reason":"Slight regression vs bare byte writes"}}
{"run":15,"commit":"da7fb0e","metric":4272,"metrics":{"codegen_allocs":131,"compile_allocs":551,"compile_ns":20730,"fizzbuzz_bytes":546,"perf_bytes":1487,"perf_lines":99,"run_med_ms":125},"status":"keep","description":"Inline array literals in variable declarations: skip __arrN temp","timestamp":1778012001573,"segment":0,"confidence":8.416,"asi":{"hypothesis":"Array literals assigned directly to variables don't need a temp; inline the body into the declaration"}}
{"run":16,"commit":"cb35cc7","metric":4388,"metrics":{"codegen_allocs":132,"compile_allocs":552,"compile_ns":20883,"fizzbuzz_bytes":454,"perf_bytes":1374,"perf_lines":97,"run_med_ms":117},"status":"keep","description":"Lazy __tt_argv: only emit when args() is actually used","timestamp":1778012441625,"segment":0,"confidence":5.464935064935065,"asi":{"hypothesis":"__tt_argv setup is expensive in generated scripts; omit it when args() is never called","tradeoff":"Small codegen overhead (+116ns) for significant output size reduction (-113 bytes) and runtime improvement (-8ms)"}}
{"run":17,"commit":"9148a13","metric":4376,"metrics":{"codegen_allocs":132,"compile_allocs":552,"compile_ns":20867,"fizzbuzz_bytes":454,"perf_bytes":1341,"perf_lines":94,"run_med_ms":117},"status":"keep","description":"Skip __ret init for functions with explicit returns on all paths","timestamp":1778012679123,"segment":0,"confidence":4.420168067226891,"asi":{"hypothesis":"Functions that return on all paths don't need __ret initialization; skip it to shrink output"}}
{"run":18,"commit":"b064152","metric":4251,"metrics":{"codegen_allocs":124,"compile_allocs":544,"compile_ns":20829,"fizzbuzz_bytes":454,"perf_bytes":1341,"perf_lines":94,"run_med_ms":115},"status":"keep","description":"Fast-path simple literals in emitVarDecl: skip compileExpr for int/bool/string","timestamp":1778012833315,"segment":0,"confidence":4.2664015904572565,"asi":{"hypothesis":"Common literals (int, bool, empty string, simple string) don't need the full compileExpr machinery; emit directly"}}
{"run":19,"commit":"e0674fa","metric":4168,"metrics":{"codegen_allocs":124,"compile_allocs":544,"compile_ns":20526,"fizzbuzz_bytes":454,"perf_bytes":1341,"perf_lines":94,"run_med_ms":116},"status":"keep","description":"Final comprehensive benchmark with 10 iterations confirming 21.7% codegen improvement","timestamp":1778012897802,"segment":0,"confidence":4.1138790035587185,"asi":{"hypothesis":"Multiple cumulative optimizations: fast literals, direct __ret, inline arrays, lazy __tt_argv, simplified tests, skipped temps, all-paths-return analysis"}}
{"run":20,"commit":"e0674fa","metric":4167,"metrics":{"compile_allocs":544,"compile_ns":20523,"fizzbuzz_bytes":454,"perf_bytes":1341,"perf_lines":94,"run_med_ms":115,"codegen_allocs":124},"status":"discard","description":"Fast-path literals in emitAssign/emitReturn via shared tryEmitLiteral helper","timestamp":1778013259252,"segment":0,"confidence":4.551181102362205,"asi":{"hypothesis":"Share literal fast-path across emitVarDecl, emitAssign, emitReturn to avoid compileExpr for int/bool/string literals","rollback_reason":"No measurable improvement on benchmark (4167 vs 4168 baseline); bench script lacks literal assignments/returns","next_action_hint":"Try ident cache in compileIdent or bare $var in emitAssign for simple identifiers"}}
{"run":21,"commit":"e0674fa","metric":4167,"metrics":{"codegen_allocs":120,"compile_allocs":540,"compile_ns":20459,"fizzbuzz_bytes":454,"perf_bytes":1343,"perf_lines":94,"run_med_ms":112},"status":"discard","description":"Bare $var in emitAssign/emitReturn/emitVarDecl: skip $((...)) for simple identifiers","timestamp":1778013495350,"segment":0,"confidence":3.7777777777777777,"asi":{"next_action_hint":"Try ident cache in compileIdent or more fmt.Sprintf->concat in builtins","rollback_reason":"No primary metric improvement (4167 vs 4168 baseline); bench lacks identifier-heavy patterns. codegen_allocs did drop 124→120 though."}}
{"run":22,"commit":"e0674fa","metric":4438,"metrics":{"codegen_allocs":126,"compile_allocs":546,"compile_ns":20917,"fizzbuzz_bytes":454,"perf_bytes":1343,"perf_lines":94,"run_med_ms":120},"status":"discard","description":"Cache compileIdent results by symbol pointer","timestamp":1778013713261,"segment":0,"confidence":3.6815286624203822,"asi":{"rollback_reason":"Map overhead outweighs benefit for small scripts; 4438ns is +6.5% worse than baseline","next_action_hint":"Try preallocating strings.Builder capacity, or optimize builtin lowering strings"}}
{"run":23,"commit":"92d8fee","metric":3815,"metrics":{"codegen_allocs":125,"compile_allocs":545,"compile_ns":20334,"fizzbuzz_bytes":454,"perf_bytes":1343,"perf_lines":94,"run_med_ms":115},"status":"keep","description":"Replace fmt.Sprintf in hot paths: itoa64 for IntLit, string concat in arithOp","timestamp":1778013949155,"segment":0,"confidence":4.373913043478261}
{"run":24,"commit":"fdc0bb7","metric":3654,"metrics":{"codegen_allocs":117,"compile_allocs":537,"compile_ns":20330,"fizzbuzz_bytes":454,"perf_bytes":1341,"perf_lines":94,"run_med_ms":119},"status":"keep","description":"Replace fmt.Sprintf with string concat in emitForRange","timestamp":1778014220173,"segment":0,"confidence":4.904552129221733}
